{
  "schemaVersion": "0.2.0-oa",
  "executionContractId": "xct:oa-001",
  "projectId": "prj:campus360-oa",
  "cycleInstanceId": "cyc:modeled-001",
  "decisionRefs": [
    "dec:oa-001"
  ],
  "confirmationRef": "cnf:n3-exec-001",
  "action": "publish-modeled-pack",
  "target": "sfia-v3-modeled/v3-native-option-a",
  "scope": "docs+schemas+examples only",
  "requiredCapabilities": [
    "cap:git-docs"
  ],
  "requiredAuthority": "N3",
  "constraints": [
    "no-runtime-code"
  ],
  "stopConditions": [
    "AUTHORITY_DENIED"
  ],
  "evidenceRequirements": [
    "evreq:schemas"
  ],
  "reversibility": "partially_reversible",
  "idempotencyKey": "idem-xct-oa-001-superseded",
  "correlationId": "corr:oa-demo-001",
  "status": "superseded",
  "version": 2,
  "supersessionReason": "Replaced by xct:oa-successor-001 after decision source superseded.",
  "immutableAfterConfirm": true
}
