{
  "schemaVersion": "0.2.0-oa",
  "executionContractId": "xct:oa-draft-001",
  "projectId": "prj:campus360-oa",
  "cycleInstanceId": "cyc:modeled-001",
  "decisionRefs": [
    "dec:oa-001"
  ],
  "doctrinePackageRef": {
    "doctrinePackageId": "pkg:studio-v3-oa",
    "version": "1.0.0",
    "digest": "sha256:aaaaaaaaaaaaaaaaaaaaaaaaaaaaaaaaaaaaaaaaaaaaaaaaaaaaaaaaaaaaaaaa",
    "resolvedAt": "2026-07-23T21:00:00.000Z",
    "resolver": {
      "actorId": "actor:studio",
      "role": "system",
      "displayName": "Studio"
    },
    "status": "resolved"
  },
  "action": "publish-modeled-pack",
  "target": "sfia-v3-modeled/v3-native-option-a",
  "scope": "docs+schemas+examples only",
  "requiredCapabilities": [
    "cap:git-docs"
  ],
  "requiredAuthority": "N2",
  "constraints": [
    "no-runtime-code",
    "no-sql"
  ],
  "stopConditions": [
    "DOCTRINE_UNRESOLVED",
    "AUTHORITY_DENIED"
  ],
  "evidenceRequirements": [
    "evreq:schemas"
  ],
  "reversibility": "partially_reversible",
  "idempotencyKey": "idem-xct-draft-001",
  "correlationId": "corr:oa-demo-001",
  "status": "draft",
  "version": 1
}
